{
  "$schema": "https://json-schema.org/draft/2020-12/schema",
  "type": "array",
  "items": {
    "type": "object",
    "properties": {
      "address": {
        "type": "string"
      },
      "description": {
        "type": "string"
      },
      "donationButtonId": {
        "type": "string"
      },
      "email": {
        "type": "string",
        "format": "email",
        "pattern": "^(?:[A-Za-z0-9_'+\\-]+\\.)*[A-Za-z0-9_'+\\-]*[A-Za-z0-9_+-]@(?:[A-Za-z0-9][A-Za-z0-9\\-]*\\.)+[A-Za-z]{2,}$"
      },
      "fiscalCode": {
        "type": "string"
      },
      "membershipButtonId": {
        "type": "string"
      },
      "name": {
        "type": "string"
      },
      "navigation": {
        "type": "array",
        "items": {
          "type": "object",
          "properties": {
            "label": {
              "type": "string"
            },
            "href": {
              "type": "string"
            }
          },
          "required": [
            "label",
            "href"
          ]
        }
      },
      "newsletterAction": {
        "type": "string",
        "format": "uri"
      },
      "newsletterHoneypot": {
        "type": "string"
      },
      "socials": {
        "type": "array",
        "items": {
          "type": "object",
          "properties": {
            "label": {
              "type": "string"
            },
            "url": {
              "type": "string",
              "format": "uri"
            }
          },
          "required": [
            "label",
            "url"
          ]
        }
      },
      "tagline": {
        "type": "string"
      },
      "id": {
        "type": "string",
        "minLength": 1
      }
    },
    "required": [
      "address",
      "description",
      "donationButtonId",
      "email",
      "fiscalCode",
      "membershipButtonId",
      "name",
      "navigation",
      "newsletterAction",
      "newsletterHoneypot",
      "socials",
      "tagline",
      "id"
    ]
  },
  "$id": "https://www.xedotnet.org/schemas/site.schema.json",
  "title": "XeDotNet configuration"
}
